,ID,paragraphs
166,12,"Income statement mn 2019A 2020E 2021E 2022E CAGR Price 13Nov2019 USD 120.98 Price Target USD 135.00 Revenue 514,405 524,613 544,135 565,376 3.2 EBITDA adj 32,635 32,892 34,334 35,506 2.9 Why Overweight? Rationale A valuation slightly above StapleType companies under our coverage EBIT adj 21,957 21,815 22,719 23,507 2.3 in line when adjusted for Flipkart losses that reflects Pretax income adj 19,855 19,519 20,324 21,112 2.1 1 a continuation of solid comps and traffic, 2 Net income adj 14,465 14,365 14,811 15,174 1.6 moderate EPS growth after adjusting for Flipkart EPS adj 4.91 5.01 5.30 5.58 4.3 losses, and 3 an above average FCF and dividend Diluted shares mn 2,945.5 2,866.1 2,792.4 2,719.8 2.6 yield compared to StapleType companies. DPS 2.08 2.12 2.16 2.20 1.9"
167,12,"Upside case USD 151.00 Margin and return data Average Reflects 1 Robust comps, 2 accelerating ecom EBITDA adj margin 6.3 6.3 6.3 6.3 6.3 growth, 3 strong EPS growth after adjusting for EBIT adj margin 4.3 4.2 4.2 4.2 4.2 Flipkart losses, 4 improvement at Sams Club, 5 a Pretax adj margin 3.9 3.7 3.7 3.7 3.8 multiple closer to Staples peers, 6 an improvement in Net adj margin 2.8 2.7 2.7 2.7 2.7 consumer spending, and 7 lowerthanexpected ROIC 11.4 11.0 11.6 12.0 11.5 Flipkart losses. ROE 18.0 18.3 19.2 19.8 18.8 ROA leaseadjusted 7.7 7.5 7.8 7.8 7.7 Downside case USD 115.00 Reflects 1 slowing comps, 2 a meaningful slowdown in ecom growth, 3 greater than expected Balance sheet and cash flow mn CAGR margin contraction, 4 significant increase in capex to Tangible fixed assets 104,317 104,908 104,293 103,294 0.3 support ecommercetechnology, 5 a slowdown in Cash and equivalents 7,722 4,646 5,202 6,178 7.2 consumer spending, and 6 largerthanexpected Total assets 219,295 216,568 219,298 223,162 0.6 Flipkart losses. Short and longterm debt 56,157 49,838 49,838 49,838 3.9 Total liabilities 139,661 139,084 142,745 146,632 1.6 UpsideDownside scenarios Net debtfunds 47,706 46,489 45,488 43,162 3.3 Shareholders equity 79,634 77,484 76,553 76,530 1.3 Change in working capital 295 17,404 2,965 2,278 97.7 Cash flow from operations 27,753 18,642 27,587 27,460 0.4 Capital expenditure 10,344 11,265 11,000 11,000 NA Free cash flow 16,349 15,600 17,033 17,809 2.9"
168,12,Valuation and leverage metrics Average PE adj x 24.6 24.1 22.8 21.7 23.3 EVEBITDA adj x 12.2 12.0 11.5 11.1 11.7 Equity FCF yield 4.6 4.5 5.0 5.4 4.9 PSales x 0.7 0.7 0.6 0.6 0.7 PBV x 4.5 4.5 4.4 4.3 4.4 Dividend yield 1.7 1.8 1.8 1.8 1.8 Adj debtEBITDAR x 2.0 2.0 1.9 1.4 1.8
169,12,"Figure 1 shows our valuation framework for WMTs Brick and Mortar business. We estimated the values of WMTs ECommerce business includes Walmart U.S. and Sams E Commerce businesses, Flipkart, and PhonePe and also Sams Club, then adjusted our total"
170,12,"Walmart enterprise value to derive an implied valuation for Walmarts brick and mortar business. While we are not suggesting we look at valuation this way, some investors are and as detailed in the figure, the core brick and mortar business, using this methodology, is"
171,12,FIGURE 1 Walmart Brick and Mortar Valuation
172,12,FIGURE 2 FIGURE 3 Walmart Current Valuation Walmart Price Target Valuation
173,12,FIGURE 4 WMT 3Q Results vs. Expectations
174,12,FIGURE 5 WMT 3Q Segment Results vs. Expectations
175,12,FIGURE 6 Barclays WMT Estimates vs. Consensus
176,13,"WMT posted strong sales with US comps of 5.6, in line with consensus 5.4 per Consensus Metrix but below our previewed 7 expectationsour estimate. EPS was slightly ahead of consensus 2 with a small operating profit shortfall offset by interest and tax. As we previewed, the margin upside was driven by strong WMT US performance 54 bps while the companys overall gross margin was flat vs. Street down 30, but inline with our estimate."
177,13,"Guidance brackets Street. On the guidance front, WMT introduced its FY23 guide with US comps of slightly above3 vs. Street 3.0 heading into today, and EPS MSD exdivestitures vs. Street 5."
178,13,Tweaking estimates maintaining 157 Dec 2022 price target. We are tweaking our estimates and maintaining our Dec 22 PT of 157 based on 21x FY1 PE on our
179,13,"Introduces FY23 guidance inline with the street and LTgrowth algorithm. WMT introduced its preliminary FY23 guide. It expects a 3 net sales increase 4 ex divestitures, US comp slightly above 3 ex fuel vs. Street 3.0, operating income increase about 3 exdivestitures, at a higher rate than net sales, tax rate 25 26, EPS increase MSD vs. Street 5, and capital expenditures at the higher end of 2.5 3.0 of sales."
180,13,"4Q in review WMT reported 4QEPS of 1.5310 YOYvs. consensus 1.49on a US comp of 5.6 vs. consensus of 5.4 with US ecommerce growing 1for 70 on a twoyear stack. Gross margin was flattish YOY vs. consensus down 30primarily due to pricing actions, and mix partially offset by higher supply chain costs. US GM leverageof 54bps was driven by pricing and increased contributions from its growing digital businesses partially offset by increased costs in the supply chain. WMT US SGA was up 95 bps YOY driven by investments in wages partly offset by strong sales and lower COVID costs benefitting 40bps."
181,13,"From a merchandising standpoint, US grocery comps were up HSD reflecting continued market share gains aided by slightly wider price gaps than prepandemic levels. Health wellness comps were midteens and gen merch was LSD with strength in apparel, automotive, and seasonal items including strong holiday sales performance."
182,14,"212 5886583 Judging from the negative reaction to PayPals PYPL 4Q18 earnings report during extended trading today, investors had set a high expectations bar for the company heading into the print such that a good butnotgreat report was not sufficient to buoy the stock. With that said, we saw much in PYPLs report to support our view that the companys growth story remains very much on track."
183,14,"While PYPL posted a 4Q18 adjusted earnings per share beat 0.69 versus the consensus estimate of 0.67 and our estimate of 0.66 some investors were apparently disappointed that the companys revenue of 4.23bn fell short of the consensus estimate of 4.24bn 12month target even as it was near the midpoint of managements guidance range. The main culprit was eBay EBAY, Not Rated management noted that if EBAYs 4Q18 contribution had matched that of 3Q18, then 52week range PYPL would have collected an incremental 32mm of revenue. Dividend Yield Market Cap m With shares of PYPL having surged by 20.5 since December 24 and outperforming Visa V, Not Rated and Mastercard MA, Not Rated which rose by 13.0 and 16.5, respectively, during that span, we believe a minor miss versus expectations was likely to trigger a retreat."
184,14,"We are reiterating our Buy recommendation on PYPL and price target of 95 based on 17x the companys FY20E adjusted EBITDA of 5,891 mm. We believe PYPLs shares continue to warrant a premium multiple in light of its growth trajectory as well as the 10.1bn in cash on its balance sheet at YE18 and that investors should view a pullback in the companys share price tomorrow as a buying opportunity."
185,14,"O ur focus heading into PYPLs 4Q18 print had been on total payment volume TPV, payment transaction volume, monetization of social peertopeer app Venmo and new account growth, and the digital payments network shined in all four."
186,14,"Valuation Our 95 price target for PayPal is based on 17x the companys FY20E adjusted EBITDA of 5,891mm. The multiple we employ is based on comparablecompany analysis."
187,14,"PYPLs TPV increased by 25 year overyear on an FXneutral basis to 164bn while payment transaction volume increased by 28 to 2.87bn. That rate of growth was down from the 28 rate of TPV growth that the company had posted in 4Q17 which management attributed in large part to zero growth from eBAY EBAY, Not Rated PYPL s TPV ex.EBAY was up 29 during the quarter."
188,14,We believe PYPLs lack of TPV growth from EBAY during 4Q18 and the fact that the companys Merchant Services revenue has grown at a rate 6x that of its revenue from EBAY since 2015 should help to ease whatever sting remains from EBAYs decision announced last January to replace PYPL with Adyen ADYEN NA as its primary payments provider in 2020. Management noted that Venmo during 4Q18 surpassed EBAY in terms of TPV on PYPLs platform.
189,14,"Meanwhile, PYPL during 4Q18 added a record 13.8mm new active accounts, up 58 versus the prior year period, including 2.9mm stemming from the companys 2018 acquisitions. Management attributed the surge in growth to its partnerships including 40 bank led marketing campaigns to drive consumers to PYPLs platform, and they said they see significant runway ahead in that metric."
190,14,"Perhaps most encouraging among PYPLs 4Q18 highlights was that 29 of Venmos users had engaged in a monetizable experience through December, up from 24 in 3Q18, 17 in 2Q18 and 13 in May. That figure made even more meaningful the 80 increase in volume to 19bn that Venmo reported during 4Q18, in our view."
191,14,Management during todays conference call said Venmo had a revenue runrate greater than 200mm at YE18. They noted that the figure was split between Instant Cash Out and commercerelated revenue.
192,14,PYPLs number of payment transactions per active accounts on a trailing 12month basis increased 9 yearoveryear to 36.9. This increase is important inasmuch as a key part of the companys growth strategy is to increase engagement among existing customers with a goal of motivating users to engage its platform 23 times a week versus 23 a month.
193,14,"PAYPAL HOLDINGS, INC. PYPL, Buy, 95.00 PT Current Price 92.42 Analyst Mark.Palmer"
194,15,"GM will host an Investor Day on November 17th. GM already hosted a special Cruise Colin M. Langan event and test drive in September therefore, we expect the investor day to focus on its EV strategy. We also expect the company to provide some broad 2023 guidance Tim Liu and possibly provide midterm margin guidance vs. 2030 target last year. The media has already reported that GM will announce EVs will be profitable by 2025. We remain skeptical that EVs can be sustainably profitable by 2025 even with IRA help, though Kosta Tasoulis pricing raw mat assumptions will be key. The timing of the event is pretty challenging, as GM will likely focus on long term, but investors are keenly focus on the near term. Moreover, we suspect near term color on 2023 might be more negative pension, mix, etc. We remain UW."
195,15,"Current consensus adj EBIT for 2023 is 10.9B vs. 2022 guidance of 1315B and our 9B estimate. GM is expected to provide some color on 2023 drivers, but not full guidance. We expect most updates will be headwinds as consensus still looks too high in our view. We are optimistic that production will rise in 2023 with improved semi supply, and GM will also benefit from the recent decline in raw material costs, which implies part of the 5B in 2022 headwinds should reverse. That said, there are also numerous challenges into 2023 including likely price decline from record levels see Exhibit 2, normalization of vehicle mix see Exhibit 1, lower pension income est. 1B headwind, continued EV investment costs, FX, and the UAW contract negotiations."
196,15,Can GM deliver on EV profitability by 2025?
197,15,"At the last Investor Day, GM promised ICE like EV margins by 2030. Since then, battery raw material costs have dramatically spiked therefore, it would be surprising if GM can still see EV profitability by 2025. While IRA is a meaningful help, we remain skeptical that EVs will be sustainably profitable by 2025. We estimate EV SUVs will be 2,850 lower profit than a comparable ICE vehicle. More concerning, we estimate EV pickups will be 12,375 lower profit than a comparable ICE pickup. Key factors to understand around EV profitability will be the pricing assumption vs. ICE, raw mat assumptions, and the inclusion of other costs advertising, marketing, RD, etc."
198,15,"At the last investor day, GM guided to doubling sales expanding margins to 1214 910 precrisis by 2030. Given investors were disappointed by the lack of midterm guide posts, we expect GM to provide midterm guides this year. We suspect any 23 year margin targets would be consistent with 910 historic margin vs. longterm targets as it takes time for SaaS to scale."
199,15,"Investment Thesis We rate GM as Underweight. GM is the largest US automaker by market share and actively invests in autonomous technology, electric vehicle development, and connected car capabilities. However, we believe that the rise in battery raw material costs has negatively impacted the outlook for BEV profitability, and consequently, GMs profitability. Moreover, US fuel economy regulations will likely force automakers to sell BEVs to meet targets. Overall, we see limited nearterm catalysts as the normalization of new vehicle pricing and higher input costs likely offset expected volume increases. In addition, we also see headwinds from the 2023 UAW contract negotiations. Target Price Valuation for GM 30.00 from NC Our 30 price target is based on 2.0x 2023E core EBITDA and 10B for its Cruise stake. Our base case reflects an 5 yy increase in FY 2022E global production 12 N America, 6 Europe, 4 China. Risks to Our Price Target and Rating for GM Notable upside risks to our price target and rating include 1 A meaningful decline in battery raw material prices. 2 Fasterthanexpected easing of semiconductor and supply chain challenges. 3 New vehicle pricing sustaining its current record strength for longer than expected. 4 The successful launch of key EV products such as the Cadillac Lyriq, GMC Hummer EV, Chevy Silverado GMC Sierra EV, Chevy Equinox EV, and Chevy Blazer EV. 5 Successful expansion of Cruises autonomous rideshare technology across the US."
200,16,EBAY EARNINGS REVIEW THE TAX MAN COMETH
201,16,"PRICE PERFORMANCE CHART Haiku The earnings were fine, but the changes to the cash, has investors spooked."
202,16,"eBay shares are down approximately 5 on the heels of solid March quarter results and June quarter guidance. Investor concern is centered on a charge the company is taking that allows the firm to repatriate its overseas cash for domestic use. The concern is that the company is positioning for a sizeable domestic acquisition that might require both the issuance of debt and the repatriation of its cash. We mention that the company has not committed to repatriating its overseas cash, and is merely setting up the option, but it is a valid question of why make the move if there is no plan to use the cash. While we would likely not support acquisitions of privately held companies such as Square or Pinterest, we mention that the current management has a respectable track record with its prior acquisitions. The largest targets have been Skype in 2006 for 3.1B, GSI Commerce in 2011 for 2.4B and PayPal in 2002 for 1.5B. The GSI Commerce deal is the only one of the three that has been executed by the current management team, and we mention that this team has not historically grossly overpaid for assets."
203,16,Ebay reported March quarter revenue of 4.26B which represents growth of 13.7 YoY and a decline of 6 sequentially and compares to our estimate of 4.23B. EPS of 0.70 was growth of 12 YoY and was above company guidance of 0.65 0.67 and above our estimate of 0.68. We highlight the following
204,16,"Second quarter FY14 guidance given by the company states revenue expected between 4.325B to 4.425B and EPS of 0.67 to 0.69. The company also maintains its 2014 full year guidance, with revenue expected between 18B and 18.5B and EPS of 2.95 to 3.00. Our 2014 estimate of revenue is at 18.3B and our EPS is at 2.98."
205,16,Marketplace revenue in the March quarter was 2.15B 10.1 YoY with a segment margin of 39.7. Total gross merchandise volume GMV exauto was 21.5B and showed growth of 12.1 YoY. Active buyers globally accelerated to 145M 14 YoY with 11.4 YoY growth in sold terms. US GMV exauto grew 10.8 YoY to 8.1B.
206,16,"Total Payments revenue in the March quarter was 1.84B 19.2 YoY, with a segment margin of 25.7. PayPal continued the momentum from the December quarter in the March quarter, with 148.4M 16.2 YoY active accounts and exceeding 1B in revenue for the twelfth consecutive quarter. Net number of payments increased 22.4 YoY to 834M. Penetration on eBay was up 200 Company Data basis points."
207,16,6.5M new users were added to eBays mobile purchase in the March quarter. Mobile enabled commerce volume grew 70 to 11B in Q114.
208,16,"Balance Sheet, Estimates and target We increase our FY14 and FY15 eps estimates maintain our BUY rating and our price target of 59 on shares of eBay Inc. eBay trades at 18x our FY14 estimate with 7.8B in cash 5.99 share, 4.1B longterm debt and 1.1B in cash from operations as of March 31, 2014."
209,17,"Our review of omnichannel retailer commentary and EBAYs upward 2Q guidance revision last week indicate to us continued strength, if not acceleration, in digital commerce from March into April and May, despite brickandmortar retailers beginning to reopen across much of the country. While it is too early to tell whether ecommerce penetration will permanently ratchet higher, strong digital demand appears likely to persist over at least the near to midterm. While digital demand appears to have ramped aggressively, we also note omnichannel retailers have rapidly launched or expanded local fulfillment capabilities leveraging store footprints, and have so far seen an enthusiastic consumer response e.g., TGTs sameday services 278 YoY in its F1Q20. What does this mean for our mostly pureplay ecom coverage? Our view is somewhat mixed, but positive on balance we view accelerating growth and persistence of digital demand as strong positives that likely outweigh enhanced fulfillment capabilities among omnichannel players."
210,17,"AMZN Raise Estimates, Raise PT to 3,000. While we note ramping local fulfillment capabilities and exceptionally strong e commerce data pts from omnichannel retail competitors, we nonetheless expect that AMZN is likely to benefit from exceptionally strong ecommerce demand in 2Q, likely extending into 2H20. Though we view omnichannel retailers recent progress on BOPIScurbside as very much worth monitoring, we believe that AMZNs continued buildout of lastmile fulfillment capacity and a gradual return to more hectic work and school schedules among consumers will likely shift momentum back toward rapid delivery AMZNs 1day Prime and Prime Now from competitors storebased fulfillment options. Based on our increased forecasts and improving comparative valuations, we have raised our price target to 3,000 23x 2021E EVEBITDA from 2,725 prior and maintain our Overweight rating on AMZN shares."
211,17,"Estimate Changes. We have raised our ecommerce paid unit growth forecasts for the remainder of 2020 and 2021, and have also modeled higher 3P unit mix vs. our prior forecasts. For 2Q, we now forecast 35.5 unit growth revised upward from 27 prior, and accelerating vs. 32 unit growth reported in 1Q20 and 5446 3P1P unit mix, consistent with 2Q19. Unit growth and 3P mix are also revised upward for 2H and, modestly, for 2021. For 2020, we now forecast revenue of 349B, GAAP Op Income of 11.4B and GAAP EPS of 15.59, vs. prior forecasts of 343B 11.1B 15.11. For 2021, we now forecast revenue of 415B, GAAP Op Income of 24B and GAAP EPS of 35.57 vs. our prior forecasts of 401B 23B 34.51."
212,17,"Price Target 3000 from 2725 Our valuation is based on a sumoftheparts analysis. Our 3,000 price target represents 23x 2021E EVEBITDA. Risks include ongoing investment in Amazons infrastructure both on the AWS and Retail sides of the business, entries into new retail categories where Amazon is less experienced, competition from traditional brick and mortar players, and challenges expanding into newer international markets such as India."
213,17,"We remain confident on AMZNs ability to drive penetration of additional retail product categories and key emerging geographies, maintain its lead in cloud computing and execute against additional opportunities such as online advertising across both endemic and nonendemic advertiser categories, which we believe offer the company compelling growth and profit characteristics."
214,17,"Amazon.com, Inc. offers services to consumers, sellers, and developers through its retail websites. It also manufactures and sells the Kindle ereader. The Company offers programs that enable sellers to sell their products on its websites and their own branded websites. Amazon.com serves developers through Amazon Web Services AWS, which provides access to technology infrastructure that developers can use to enable any type of business. In addition, the Company generates revenue through cobranded credit card agreements and other marketing and promotional services, such as online advertising. Amazon.com has organized its operations into two principal segments North America and International."
215,18,"Today 53, we hosted a post Q1 earnings call with Fords CFO, John Lawler Fords Colin M. Langan President of Americas and International Markets Group, Kumar Galhotra and Fords Head of Investor Relations, Lynn Tyson. While the Q2 semirelated production cuts were disappointing, it is a onetime issue, and we remain upbeat about the potential of the underlying business. We also are optimistic heading into the May 26th investor day with likely positive updates on EV and connected car strategies. There were three key highlights from our call."
216,18,"1 Despite 3 fold increase in lost units, Ford held the impact to the high end of guidance"
217,18,"Coming out of Q1, investors were unclear how to frame the size of the guidance cut. Ford claried original guidance for the semi impact was 12.5bn, reecting the loss of 200400k units. Post the Renesas re the number of units impacted rose to 1.1m, yet the impact was contained at 2.5bn. Ford highlighted the underlying performance for the business is running at the original 89bn excluding the semi supply issue."
218,18,2 Sounds like Ford will not be alone in the Q2 semiconductor supply impact
219,18,"In our recent semi supply chain update note, we highlighted VCs guidance of production of down 1827 qq, implies Ford 30 qq might not be a large Q2 outlier. On our call today, we got the same impression. While Ford could not speak directly to competitors, the company thinks it too early to say they are more impacted. Ford highlighted most of the chips are supplied in modules sourced by the shared global supply chain, therefore, it would be surprising that only Ford would see a large impact if other automakers depend on these same suppliers. Ford also indicated cuts are now made on relatively short notice, as supplier schedules are changing weekly vs. monthly. This may explain why the large cut surprised most forecasters. Visibility into the semi supply chain is very challenging given there are several layers of companies between the semi manufacturers and the automakers. It is unclear how much semi inventory had been held at suppliers, though most suppliers are likely depleted of buer stocks as this point. We also note that over the last few days, more cuts were announced. According to Auto News, GM extended downtime at Fairfax Malibu to July 5, Lansing Camaro, CT45 is down next week until June 28, and CAMI Equinox is down until June 28. VW indicated it lost 100k units in March and that shortages will intensify in Q2."
220,18,3 Ford is making strong progress on warranty costs
221,18,"Ford reported a 400m yy decline in Q1. The CFO noted there was nothing one time driving that improvement. In addition, the warranty change was mostly driven by normal coverage, not recall related which may be more lumpy. This indicates positive performance should be sustained if current quality holds. Ford also indicated that warranty could improve as the company leverages their connected capabilities to do over theair OTA updates, which have already been done on the Mustang MachE."
222,18,"We remain OW on Ford given signicant margin upside driven by new higher prot products trucks and SUVs, the acceleration in its restructuring actions, and lower warranty."
223,18,How will Ford emerge dierent from supply issue?
224,18,"Ford is focused on learning from this supplier chain crisis. There are three key areas Ford will operate dierently going forward. One, the company is assessing its supply chain and determining where more buer stock may be needed going forward. Two, the company has learned how to better manage sales with low inventory levels, and therefore will keep inventory lower than historic levels post crisis. Three, Ford is more focused on a seamless online order system, having developed an improved reservation system during the crisis."
225,18,"Ford has indicated it will announce another 2.5bn in restructuring actions by yearend. The company has already announced 2.5bn of actions related to the Brazil plant closures announced in January accrued in Q4. We think it sounds like the facilities in India might be at risk as this is the only region that was unprotable for International. Ford has indicated it will wait until the second half of the year to provide an update on India. International margins of 8.9 in Q1 were impressive considering India was unprotable. While Ford downplayed the potential for closing another plant in Europe, we still see the Focus plant as at risk."
