,ID,paragraphs
284,23,"We believe the investments McDonalds has been making to improve food quality perceptions fresh beef, consumer access mobile ordering, Experience of the Future and value 1 2 3 Dollar Menu is resonating with guests. While traffic did turn negative this quarter, we believe the upcoming launch of fresh beef and increasing awareness of the new Dollar Menu will sustain the conc epts sales gains while technology becomes a greater contributor."
285,23,"Digital Investment Continuing . Following last years launch of mo bile ordering in 20k locations globally, deployment of Experience of the Future in store kiosks continues in the U.S. with another 4,000 U.S. restaurants expected to be converted this year. This will result in roughly half of the U.S. system modernized by yearend, a schedule that has been accelerated in recent quarters. While the initiative remains new, management indicated that initial markets for EOTF have seen further sales gains in the second year rather than just an initial lift. This continues to give us a favorable view of U.S. comps in the coming years given the significant pace of deployment this year."
286,23,"MCDONALDS CORPORATION MCD, Buy, 200.00 PT Current Price 158.30 Analyst Peter Saleh"
287,24,Core EPS was ahead of consensus as a lower than expected loan loss provision and tax rate more than
288,24,"offset softer than anticipated fee income net interest income inline. Looking out, it sees 2021 net"
289,24,interest income of 3537bn and expenses of 53bn our sense is these ranges are below investor
290,24,"expectations. While its slides showed a longerterm ROTCE target of 15, no time frame was offered, and"
291,24,"while it has identified in excess of 8bn of potential gross expenses savings, it did not offer a net number."
292,24,2021 net interest income Sees 2021 NII flat to down 4 from the annualized 4Q20 level of 36.8bn so
293,24,35.336.8bn. This reflects the announced sale of its student loan portfolio which accounts for 1 of the decline and
294,24,assumes the asset cap will remain in place for 2021.
295,24,ex. customer remediation accruals and restructuring charges. Its 2021 outlook includes 1bn of operating losses
296,24,Expense program In excess of 8bn of potential gross saves identified. Said it will continue to invest across its
297,24,pipeline of efficiency initiative concepts being vetted.
298,24,"ROTCE Compared to an 8 ROTCE in 4Q20, adjusted for expected efficiency initiatives and optimized capital levels, it"
299,24,"sees its pro forma ROTCE at 10. It said its longerterm ROTCE target is 15, though no timeframe specified."
300,24,Share repurchase Its Board approved an increase in its authority to repurchase common stock by an additional
301,24,Lower provision drives beat . WFC reported 4Q20 EPS of 0.64. Our estimate was 0.65 and consensus was 0.60.
302,24,Results included a 781mn 0.14 restructuring charge and 321mn 0.06 of customer remediation accruals partially
303,24,offset by a 757mn 0.14 reserve release due to the announced sale of its student loan portfolio. Net these cost it
304,24,Profitability metrics pressured. Operating revenues declined 8 yoy and were little changed linked quarter at
305,24,"72.4bn. Tangible book increased 3 to 33.04 trading at 1.1x. It posted a ROA of 0.62, ROE of 6.4 and ROTCE"
306,24,"was 7.7. Its CET1 ratio increased 20bps to 11.6, TLAC was unchanged at 25.8 and its LCR was 133 134 in"
307,24,3Q20. Its average diluted share count increased 0.5.
308,24,"NII slips, loans drops. Net interest income declined 1 reflecting lower loan balances on lower customer demand and"
309,24,"elevated prepayments, and the impact of lower interest rates, which drove a repricing of the balance sheet. Average"
310,24,"earning assets rose 1 with loans down 3 commercial 4, consumer 2 and securities up 4. Periodend loans"
311,24,"declined 4. Commercial fell 1 with CRE little changed and CI 1, construction 3 and leasing 5 lower."
312,24,"Consumer fell 6 with credit card 2 up and other 26, HE 7, mortgage 6, and auto 1 lower."
313,24,"NIM stable. Its net interest margin was unchanged at 2.13. Its yield on AEA declined 4bps to 2.41 loans 2bps,"
314,24,"securities 14bps, while its cost of IBL decreased 6bps to 0.39 IBD 6bps to 0.07. Average deposits declined 1"
315,24,and Commercial Banking. Its average deposit costs declined 4bps to 0.05.
316,24,"Fees, costs little changed. Fee income was little changed linked quarter. Increased gains from equity investments and"
317,24,"higher brokerage advisory, commissions and other fees were offset by declines in trading, operating leases and"
318,24,"mortgage. Core expenses increased 1 yoy and rose modestly from 3Q20. Sequentially, personal costs increased"
319,24,"while other categories declined. Its tax rate was 3.5, down from 22.5 in 3Q20."
320,24,"NPAs up, NCOs down . Its NPA ratio increased 11bps to 1.00. Dollar NPAs rose 9, or 709mn, to 8.9bn. The"
321,24,"increase was driven by its CRE, mortgage, and lease portfolios, partially offset by a decrease in CI. Its NCO ratio"
322,24,declined 3bps to 0.26. Its commercial 3bps and consumer 4bps NCO ratios were both 0.26. Commercial NCOs
323,24,were impacted by a small number of credit exposures in the CRE portfolio. Consumer losses decreased as the impacts of
324,24,"government stimulus programs and customer accommodations, including payment deferrals, continued to impact"
325,24,"performance. It posted a provision benefit of 179mn, compared to a 769mn expense in 3Q20. This resulted in a"
326,24,"763mn loan loss reserve release, compared to a 38mn build in the prior quarter. The reserve release was"
327,24,predominantly due to the announced sale of its student loan portfolio. Its reserveloan ratio was stable at 2.22.
328,24,Results Relative to Expectations FULL MODEL ATTACHED
329,24,"Jason M. Goldberg, CFA Managing Director Equity Research LARGECAP BANKS"
330,25,"INVESTMENT HIGHLIGHTS 70.00 Q3 was especially after adjusting for FX impact highlighted by 28 yy billings growth in constant currency, which suggests the health of fundamentals and secular trends. While some might be disappointed by the SaaSApplication Software inline revenue guide and light F16 rev guide, were not at all concerned. We believe Salesforce is the highest quality, bestscaled SaaS vendor in our universe leveraged to numerous secular trends, and we appreciate that F16 guidance is prudently conservative, suggesting ample headroom for significant upside revisions especially on the heels of a potentially very strong Q4 which likely stands to benefit from Dreamforce momentum."
331,25,"Were particularly encouraged by record large deal activity the number of 8figure deals up 2x yy, which likely reflects the credibility of the companys industry vertical positioning rolled out roughly 9 months ago, comprehensive platform strategy, and SI partner ecosystem. We believe the strength of 8figure deals in 3Q bodes well for 4Q performance, which has historically been even better aligned to EOY and BOY enterprise budget cycles."
332,25,"Not surprisingly and consistent with recent Dreamforce commentary, the hot topic on the call was around recently launched Wave Analytics next generation, easy to use, mobilefriendly analytic platform for the masses, launched a few weeks ago. Impressively, the product cycle appears to be strong out of the gates including marquee enterprise wins such as GE, Verizon, and EMC and a ramping partner ecosystem including ISVs and SIs, which suggests another compelling growth driver that could layer onto the model longer term."
333,25,"Other highlights included a beat on the top and bottom line despite nontrivial FX headwinds, inline F15 guidance despite FX headwinds, steady bookings growth in CC, solid total backlog growth, strength across product areas and geographies and impressive marquee customer wins. Stock Price Performance"
334,25,"Management was upbeat on the call, especially with respect to continued momentum coming out of Dreamforce more than 150K registered, more than 7MM joined online, already impressive uptake from new analytics cloud offering, increased vertical traction, competitive positioning, ramping product cycles and deepening strategic customer relationships."
335,25,"Management guided F15 EPS to 0.510.52 vs. Street estimate of 0.51 and CFO to 2728 yy growth. Management initiated FY16 revenue guidance of 6.456.50B, which includes roughly 125150MM FX headwind."
336,25,"Q3 especially after adjusting for FX impact was highlighted by 28 yy billings growth in constant currency, which suggests the health of fundamentals and secular trends. While some might be disappointed by the inline revenue guide and light F16 rev guide initiated rev guidance to 6.456.50B vs. Street consensus of 6.66B, were not at all concerned. In our view, Salesforce is the highest quality, bestscaled SaaS vendor in our universe leveraged to numerous secular trends, and we appreciate that F16 guidance is prudently conservative, suggesting ample headroom for significant upside revisions, especially on the heels of a potentially very strong Q4 which likely stands to benefit from Dreamforce momentum."
337,25,"Were particularly encouraged by record large deal activity the number of 8figure deals up 2x yy, which likely reflects the credibility of the companys industry vertical positioning rolled out roughly 9 months ago, comprehensive platform strategy, and SI partner ecosystem. We believe the strength of 8figure deals in 3Q bodes well for 4Q performance, which has historically been even better aligned to EOY and BOY enterprise budget cycles."
338,25,"Not surprisingly and consistent with recent Dreamforce commentary, the hot topic on the call was around recently launched Wave Analytics next generation, easy to use, mobilefriendly analytic platform for the masses, launched a few weeks ago. Impressively, the product cycle appears to be strong out of the gates including marquee enterprise wins such as GE, Verizon, and EMC and a ramping partner ecosystem including ISVs and SIs, which suggests another compelling growth driver that could layer onto the model longer term."
339,25,"Other highlights included a beat on the top and bottom line despite nontrivial FX headwinds beat Street estimates by 10 million on the topline, despite negative FX impact of 15 million qq, inline F15 guidance despite FX headwinds we estimate additional Q4 impact of 15 million qq, impressive bookings growth billings up 28 yy in CC vs. up 30 in CC in 2Q15, solid total backlog growth up 29 yy in CC vs. up 32 in Q2, strength across product areas highlighted by Service Cloud revs up 7 qq, Marketing Cloud revs up 7 qq and Platform Cloud revs up 6 qq and geographies led by 34 yy growth in EU and 29 yy growth in Americas using constant currency and impressive marquee customer wins including Archer Daniels Midland, Johnson Johnson, US Department of Commerce, Barclays, Merck, NBC, and Toyota."
340,25,"Importantly, we dont detect any meaningful deterioration of sales cycles, close rates, or demand trends across geographies due to macro pressures or to a constrained IT spending environment, which suggests the strength of competitive positioning, the strength of the SaaS secular, the numerous product cycles, the quality of leadership including new CFO Mark Hawkins, former CFO at Autodesk and VP Finance at Dell, the increasing support of the channel, and the magnitude of opportunity ahead. We continue to believe that Salesforce is the highest quality and best scaled SaaS name in our universe, with numerous product cycles leveraged to the rising strategic importance of SaaS, which certainly suggests favorable riskreward relative to other subscaled, slower growing SaaS names."
341,25,"Q3 revenue was 1.38B up 29 yy vs. up 38 in Q2 vs. up 37 in Q1 vs. up 37 in Q4 vs. Street target of 1.37B. EPS was 0.14 vs. Street of 0.13, benefited by the revenue upside and scale economies and likely offset by the impact of Dreamforce and Connections to a lesser degree. Gross margins compressed to 78.4 vs. 79.3 in Q2, while operating margins remained flat qq at 11.0 vs. up 130 BP in Q2, likely reflecting new international data center roll outs. CFO was 123 million, down 11 y y vs. up 34 in 2Q vs. up 67 in 1Q vs. down 4 in 4Q, impacted by the timing of Dreamforce Q3 this year vs. Q4 last year. Salesforce added 313 heads in Q3 vs. 906 in Q2 vs. 927 in Q1 vs. 542 in Q4, bringing total headcount to 15,458."
342,25,"Management was upbeat on the call, especially with respect to continued momentum coming out of Dreamforce more than 150K registered, more than 7MM joined online, already impressive uptake from new analytics cloud offering, increased vertical traction, competitive positioning, ramping product cycles and deepening strategic customer relationships which is driving increased large deal activity. For FY15, management raised the lowend of revenue guidance by 25MM to a range of 5.3655.37B vs. previous guidance of 5.345.37B vs. Street estimate of 5.37B. Management guided F15 EPS to 0.510.52 vs. previous guidance of 0.500.52 vs. Street estimate of 0.51 and CFO to 2728 yy growth and for operating margins to expand by 125 to 150 bps yy in F15. For Q4, management guided revenueEPS to 1.4361.441B0.130.14 vs. Street 1.45 B0.15 assuming a negative 15 million FX impact qq. Management initiated FY16 revenue guidance of 6.456.50B, which includes roughly 125150MM in FX headwind."
343,25,"We are revising up our FY15 revenue estimate to 5.37B from 5.35B and our EPS estimate to 0.52 from 0.50. We are also adjusting our F16 revenue estimate to 6.47B from 6.57B and our EPS estimate to 0.65 from 0.66 to reflect the newly initiated F16 guidance. At the end of the day, we continue to believe that managements decision to reinvest incremental margin to drive growth opportunities and market share gains next year and beyond makes sense given the predictability and natural leverage of the SaaS model and given key secular trends and competitive leadership."
344,25,"CRM shares trade at 6.1x EVCY15Revs, but support a more premium multiple in our view given the company is the best scaled, highest quality SaaS name in our universe. Were maintaining our price target of 70, predicated on 7x EVCY15Revs, which we believe is reasonable for the topshelf SaaS name in our universe with significant growth drivers and strengthening competitive positioning ahead. Risks to Target"
345,25,Risks 1 Macroeconomic weakness could weaken renewals and delay sales cycles 2 Increasing competition could impact new and renewal pricing 3 Recent acquisitions could distract management and impact execution around core business 4 Unknown adoption rates of new products.
346,26,We expect a positive reaction to CVXs 3Q21 update. The company beat Barclays and consensus on both EPS and CFPS
347,26,while capex came in significantly lower than our model and FY21 CE guidance was reduced by 4 at the midpoint.
348,26,"Some may point to the benefit of lower than normal corporate charges, but we note that operating segment"
349,26,upstreamdownstream earnings were 1420 above BarclaysStreet. Debt reduction was stronger than anticipated
350,26,"due to higher cash flow and lower capex, and we expect debt reduction momentum will continue in 4Q21 with a"
351,26,"CVX is targeting 750mm buybacks in 4Q21, at the highend of its annualized 2 3bn buyback guidance range. In a"
352,26,"Bloomberg interview today, CVXs CFO commented that Were fast approaching a netdebt ratio where we could"
353,26,increase our buyback guidance range even further. At the current strip our model suggests that CVX could significantly
354,26,increase its buyback guidance range next year and remain comfortably below its 2025 net debt soft target. We are
355,26,than what our model suggests as we think CVX intends to undershoot 2025 net debt during periods of strong oil prices
356,26,"to ensure cash returns during lower prices. Also, managements previous stance on buybacks is that they prefer to not"
357,26,have to reduce the level once it is established and we note the 14bbl Brent backwardation in the strip between 2022
358,26,"Big 3Q21 earnings beat . CVX reported adjusted EPS of 2.96 compared to BarclaysConsensus of 2.272.22,"
359,26,while CFPS of 4.69 was 1511 above BarclaysConsensus. Better earnings and a higher than expected deferred
360,26,income tax provision drove the cash flow beat vs. our model.
361,26,While earnings benefitted from lower than expected corporate charges 150mm vs. our 765mm
362,26,"Adjusted upstream earnings of 4,650mm were 1619 above BarclaysConsensus."
363,26,"Total downstream earnings of 1,110mm were 722 above BarclaysConsensus."
364,26,"Strong capex beat Total capex including affiliates of 2,770mm was 25 below Barclays estimate, while cash"
365,26,"capex of 1,907mm was 23 below our estimate."
366,26,CVX reduced its full year capex guidance from 13bn to 12 13bn due to Covid19 related spend
367,26,"Production inline Total production of 3,034 mboed was inline with both Barclays and Bloomberg Consensus"
368,26,with liquidsnatural gas coming in 1 below1 above our estimates.
369,26,Better than expected Permian unconventional production Permian production of 623 MBOEd was 7 above
370,26,Net debt improves Net debt declined by 4.1bn to 31.3bn and CVXs quarter end net debt ratio of 18.7 was
371,26,Buybacks at the high end CVX is targeting repurchases of 750mm in 4Q21 compared to our current estimate
372,26,of 625mm. The implied annualized rate of 3bn is at the high end of the companys previously provided 2 3bn
373,27,"We downgrade our rating from Overweight to Equal Weight, our ests. by about 15 for Mike Mayo, CFA each , and our price target from 210 to 180 15x 2023E EPS roughly in line with 20yr avg. This issue is certain to us frontloaded spending for less certain back Christopher Spahr ended benets. JPM continues to reect our Goliath is Winning theme, but the cost and time frame for doing so is greater and longer than expected. Indeed, there was zero assurance that this historic increase in expenses will level o after this year. Moreover, Robert Rutschow we believe JPM is more expensive than the average bank at a time when other banks are more pure plays on our 2022 theme, NII to the Sky. We continue to favor the banks featured in our new report, 2022 Outlook Stay Aboard the Bank Train. Eric Chan To us, JPM is spending the benets of rate increases, which Expenses are the issue. should keep its ROTCE below its target of 17 for the next few years. JPM guides for 8 higher expenses in 2022 due to inationcompTE normalization 40 and deliberate increases in investments 60, implying a second year in a row of negative operating leverage. While JPM indicated that it intended to gain market share in each business, it gave few other concrete metrics around future expectations even though investments targeted 15bn in 2022 are set to increase by 30 YoY and by 57 since 2019."
374,27,"The degree of downside Big reduction to estimates given companyspecic moves. to our estimates is a surprise to us after reviewing our earnings model. We est. ROTCE declining to 15 and not getting to 17 over the next 3 years due to higher expenses, lower fee revenue in CIB and Consumer, and less buybacks thats even while the company should show the best NII growth in its history guided 12 higher core in 2022. The decline in our PT follows our est. revision downward."
375,27,"We dont see how the math works otherwise with the increase in expenses this year, especially since JPM gave no assurance that expenses would not continue to increase after 2022. Specically, JPM is projecting expenses to increase 6bn while core NII is projected to increase 5bn and the company is coming o record revenue in CIB. Netnet, we est. 2022E revenue to be up 1 while expenses are up 8 core. As a result, we lower our estimates for 2022 to 11.25 from 12.65, 2023 to 12.30 from 14.35, 2024 to 14.00 from 16.25, and 2025 to 15.50 from 18.05."
376,27,"Good longterm company, but perhaps too long of a horizon for bank stock investors, especially without more detail. This is not to say the wheels are coming o. On the contrary, JPM continues to gain market share along with progress, like the industry, in NII, loans, and mergers. Indeed, a midteens ROTCE is still decent. Nonetheless, at a time when most banks should show improving pretax prot margins, JPM is likely to go in the opposite direction over the next 12 years. In the end, we feel that the burden is on JPM to give more specics about its expected benets since they are incurring certain expenses for uncertain benets."
377,27,"Investment Thesis JPMorgan Chase rated Equal Weight has excelled at both oense and defense over the past decade in which it has been gaining market share in all major business lines while optimizing its businesses, showing consistent earnings relative to other global banks and creating a fortress balance sheet as dened by its CEO. Playing defense has carried more importance over the past few years however, greater oense is expected to play a role as JPM continues to invest long term. This issue is certain to us frontloaded spending in the near term for less certain backended benets. JPM continues to reect our Goliath is Winning theme, but the cost and time frame for doing so is greater and longer than expected. Moreover, JPM is more expensive than the average bank at a time when other banks are more pure plays on our 2022 theme NII to the Sky."
378,27,Upcoming Catalysts JPM is not holding an investor day this year the same as 2021 resulting in less interaction with the company and management than in preCOVID years. Upcoming companyspecic events include its 10K release in February incl. updated interest rate sensitivity information and 1Q22 results in April. The Feds FOMC meeting in March can act as a catalyst for the industry along with intrameeting commentary by FOMC members and any change to the outlook for Fed Funds rate hikes.
379,27,"Risk v. Reward UpsideDownside Scenarios Base Case We arrive at a price target of 180, which implies 14.6x our 2023E EPS, based on the simple average of six valuation techniques PE, pricetobook, discount dividend model, PEG ratio analysis and sum of the parts for both PE and PB. The 20year forward PE for JPM has been 14x, and we assume a slightly higher level given its higherquality balance sheet and earnings consistency overall."
380,27,"Macro downside risk factors include a slowdown in global economic activity, greaterthanexpected increases in unemployment and bankruptcies in the US and abroad, and adverse changes in US and foreign laws and regulations. Companyspecic downside risks include higherthanprojected credit losses especially in credit cards and home equity but also other consumer areas and commercial lending, market and interestrate risks which can aect JPMorgans businesses and portfolios in a variety of ways, especially MSRs and investment securities, and operational risks primarily associated with regulatory compliance across the rms domestic consumer and global wholesale businesses. Risks to the upside include higher rates with a steeper yield helps traditional banking revenue, with no commensurate negative impact on capital markets activities advisory, underwriting, trading and a stronger than expected recovery resulting in stronger than expected loan growth."
381,27,"Upside Scenario Risks to the upside include higher and steeper yield curve without adverse impacts on capital markets and trading. For example, if our NIM projection for JPM were 15bps higher than projected in 2022E and if capital markets in 2022 were at 2020 levels, we est. that our 2022E EPS would be 15 higher and our target would be up roughly the same est. 205."
382,27,"Downside Scenario Risks to the downside include a lower and atter yield curve than projected, resulting in a attish NIM 2022E vs. 2021, and if 2022E capital markets revenue were at 2019 levels, then we est. our 2022E EPS would 10 lower and our target would be down roughly the same est. 155."
383,27,"We arrive at a price target of 180, which implies 14.6x our 2023E EPS, based on the simple average of six valuation techniques PE, price tobook, discount dividend model, PEG ratio analysis and sum of the parts for both PE and PB. The 20year forward PE for JPM has been 14x, and we assume a slightly higher level given its higherquality balance sheet and earnings consistency overall."
384,27,"Macro downside risk factors include a slowdown in global economic activity, greaterthanexpected increases in unemployment and bankruptcies in the US and abroad, and adverse changes in US and foreign laws and regulations. Companyspecic downside risks include higherthanprojected credit losses especially in credit cards and home equity but also other consumer areas and commercial lending, market and interestrate risks which can aect JPMorgans businesses and portfolios in a variety of ways, especially MSRs and investment securities, and operational risks primarily associated with regulatory compliance across the rms domestic consumer and global wholesale businesses. Risks to the upside include higher rates with a steeper yield helps traditional banking revenue, with no commensurate negative impact on capital markets activities advisory, underwriting, trading and a stronger than expected recovery resulting in stronger than expected loan growth."
