,ID,paragraphs
0,1,"We maintain our Overweight rating and raise our price target to 75 Key Takeaway. Roger D. Read 6.5x 2023E EVEBITDA from 71. Through the combination of reating commodity prices, substantial opex reductions and signicantly restrained capex, XOM has thoroughly Lauren Hendrix Walker reversed the nearcatastrophe that was 2020. This time last year, investors were seriously questioning XOMs ability to sustain its dividend. On todays 1029 earnings call, XOM was able to illustrate how it can return net debt to preCOVID status by yearend 2021, modestly raise its dividend and reinstate a 10bn share repurchase program. Following the inline Q321 results and update to our Q421 and 2022 forecasts, we raise our 2021 and 2022 EPS estimates. Our newold EPS estimates for 2021 and 2022 are 4.954.56 and 5.394.48."
1,1,"We remain in the minority with less than a third of the analysts rating XOM the equivalent of buy. We believe the lack of enthusiasm stemmed from concerns about XOMs balance sheet and liquidity, ability to sustain its dividend and recent history of aggressive investmentpoor returns. In our view, recent results, BoD and senior management changes and the ability to restart a share repurchase program are quite supportive of our more positive views."
2,1,"Adjustments reect Q3 2021 actuals, our updated crude Modeling Adjustments. decks and minor tweaks to production, throughputs and opex assumptions. We estimate production of 3,635 mboed, or up 20 mboed versus Q3 2021. We lift our Q4 2021 downstream and chemicals margins on better cracks and an improved demand environment. We expect XOM to repurchase roughly 7bn in shares through 2023 while reducing debt. Given our more conservative oil price forecast, we do not expect XOM to repurchase the full 10bn over the next two years. We expect capex will be towards the lowerend of the 2025bn range in 2022 and move closer to the midpoint in 2023."
3,1,"XOM expects upstream volumes to increase on lower curtailments and Q4 2021 Outlook. seasonal gas demand partially oset by higher planned maintenance. Within Downstream and Chemicals, higher planned turnarounds and maintenance should reduce volumes. XOM expects the UK North Sea sale upstream and Santoprene chemicals business to close by yearend."
4,1,XOM announced a 10bn share repurchase Buybacks to Resume and Dividend Bump. program starting in 2022 over 1224 mos and a 0.01 per share quarterly dividend increase to 0.88.
5,1,"XOM announced annual capex range of 2025bn going forward fully Capex Outlook. consistent with our forecast, including a 4x increase in lowcarbon spending. This includes cumulative lowcarbon investments of 15bn from . The company is on track to achieve 2025 emissions intensity reduction plans by end of 2021 and plans to announce accelerated Scope 1 and 2 reduction plans later in the year."
6,1,"EPS of 1.57 was in betweenour estimate of 1.58 and Q3 2021 Results Review. consensus of 1.56. CFFO of 11.4bn excluding wc adjustments 12.1bn including wc adjustments was short of our forecast of 12.4bn. Capex of 3.9bn was below our forecast of 4.1bn. Versus our forecast, better Downstream performance was oset by weaker US Upstream and Chemicals performance."
7,1,Our 75 price target is based on 6.5x our 2023 EVEBITDA forecast.
8,1,"Systematic risks to our targetrating include commodity price uctuations, political risk, environmental risk, and potential operational issues given todays regulatory environment. Companyspecic risks include operational production shortfalls, California regulatorytax hurdles, and civil strife in international locations."
9,1,"XOM We have an Overweight rating on XOM. Opex reductions combined with meaningful reversion to the mean margin performances at Chemicals and the Downstream supported by the fundamentals should allow XOM to generate 47bn of EBITDA in 2023 at just 60bbl Brent, 56bbl WTI and 2.75mmbtu natural gas. This level of EBITDA generation would be in between XOMs 2018 and 2019 performances which beneted from much higher commodity prices. We do not expect production growth and only minimal free cashow generation, which is inclusive of disposition proceeds. However, this represents a signicant change from the last several years of signicant cash burns and increased leverage. In our view, this is likely enough to lift the shares a bit higher and lessen worries about dividend sustainability and allow a resumption in share repurchases in 2022."
10,2,"Salesforce reported excellent F1Q17 results and bumped up guidance for 212 5273564 the third straight quarter. Billings and revenues came in ahead of consensus, with strong results across all geos and clouds. Offbalance sheet deferred grew 26 yy. Sales Cloud 14.5 yy continues to show nice growth even as it passes a 3.3B run rate while momentum in digital 212 5273521 transformation initiatives is starting to contribute to overall growth Marketing Cloud 32 yy exDemandware. Salesforce should easily march past 10B in revenue this year and at this rate the road to 20B looks pretty clear. CRM should continue to be a core holding."
11,2,"Excellent results. Revenues of 2.39B ahead of cons. 2.35B while FY outlook gets a 100M boost. Billings 16 yy ahead of cons. 7 on a tough compare due to increasing but well understood seasonality 12 month target in the business. Management visibility sounds very good, supported by deferred revenue strength with total deferred plus backlog now standing at 14B. Operating cash flow of 1.2B was a record and 52 week range higher than all of F16. Operating margin expansion continues at a Dividend Yield Market Cap m balanced rate 125150 bps this FY, driving nice cash flow growth 2021 yy in F18 reaffirmed."
12,2,"Sum is more than the parts. A rare case of the sum being more than the parts, Salesforce continues to deliver on its broadening platform strategy. Ongoing strength in its core CRM product augmented by high growth in marketing, platform, and service, driving plenty of upsell opportunities, including the new Einstein AI engine. Along with increasing contribution from recent acquisitions, we are comfortable that the product portfolio can drive low to mid20s growth on a consolidated basis, which give us clear line of sight to 20B. A rare achievement."
13,2,"Valuation Numbers change little, aside from shifting some expenses from F3Q to F4Q to reflect Dreamforce conference later in the year. Our 10year DCF analysis yields a 100 price target. This implies 7x EVFY18E Revenues and 36x EVFY18E FCF. Maintain Buy."
14,2,"SALESFORCE.COM, INC. CRM, Buy, 100.00 PT Current Price 87.75 Analyst Joel.Fishbein"
15,3,"Company Background Apples revenue comes from the iPhone 50 of FY20 revenue, iPad 9, Mac 10, wearables, home and accessories 11, and services 20. Main markets are the Americas 45, Europe 25, Greater China 15, Japan 8, and the rest of Asia Pacific 7."
16,3,"Investment Merits 1. 5G to drive record iPhone sales. Apples flagship 5G iPhone 12 lineup launched in 2020 sold 100mn units two months earlier than the iPhone 11. Volumes were close to its iPhone 6 supercycle during the 4G transition in 2015. Customers see 5G as a key reason for upgrading their iPhones after years of holding back replacements. Apples new iPhone 13 lineup is expected to be launched in September 2021, featuring up to 20 more efficiency and larger batteries to complement the powerhungry 5G phone. In anticipation of strong demand, Apple has ordered more than 100mn A15 chips from TSMC for the launch, 25 more than the 75mn chips for its 2020 iPhones. We expect the iPhone supercycle to continue, with FY21e and FY22e sales potentially topping 2015s record of 231mn units sold. This would be powered by upgrades from an estimated 48 of the iPhone users still using iPhone X and older. iPhone sales are Apples main cash cow, at 50 of sales in FY20."
17,3,"2. Margins to remain elevated. Strong growth in Apples services is expected to lift gross margins, together with higher ASPs of 5G devices in the product segment. Service margins of 66 are more than double product margins. Service revenue has also been expanding at a faster CAGR of 17 vs flat growth for iPhone. Growth is spearheaded by Apples evergrowing installed base, which topped 1.65bn in January 2021. Apple expects service growth to moderate after a bumper 3Q21 when YoY growth was 33 from the COVID19 rebound to more sustainable double digits. Apples 5G products also allow it to raise weighted ASPs by more than 20 from a year ago, boosting product margins. We expect gross margins to track above 40 in FY21e and FY22e, higher than their 5year historical average of 38."
18,3,"3. Gaining market share through supplychain dominance. As competitors grapple with chip shortages, Apples share of global smartphone sales breached 5year highs, hitting 21 in 4Q21. In the highend market, Samsung was hit by its Texas semiconductor fabrication plants monthlong power shutdown and Vietnam factory suspensions due to COVID19. Samsungs new Galaxy Notes launch in 2H21 may be delayed as a result. Apple managed to mitigate shortages in 3QFY21, with the revenue impact coming in lower than its US34bn guidance. Apple holds buying power over suppliers through scale purchases and upfront cash payments, leaving competitors handling price shocks and shortages created by Apple deals."
19,3,"We initiate coverage with a BUY rating. Our target price is US187.0, based on DCF valuation with a WACC of 5.8 and terminal growth of 3.0."
20,3,"Apple has five revenue segments iPhone 50 of sales, Mac 10, iPad 9, Wearables, Home and Accessories 11, and Services 20. The first four are grouped under products. Wearables, home and accessories consist of AirPods, Apple TV, Apple Watch, Beats products, HomePod, iPod touch and other Applebranded and thirdparty accessories. Services are licensing, App Store, AppleCare, iCloud, Apple Music, Apple Pay and iTunes. Service revenue grew by a 17 CAGR from FY16 to FY20 to double from 9 to 20 of total revenue Figure 3. iPhone revenue was flat in the same period but is expected to surge in FY21 and FY22."
21,3,Figure 2 Total revenue only grew at a 4.9 CAGR from FY16 to Figure 3 Service revenue growing faster than iPhone FY20
22,3,"Cost of sales grew at a 5 CAGR from FY16 to FY20, in line with its revenue CAGR of 5. Operating expenses include selling, general and administrative expenses 7 of sales and research and development 7. Over the past five years, SGA consistently ranged at 67 of sales, while RD grew from 5 to 7 of sales. Total operating expenses grew at a 8 CAGR."
23,3,"Gross margins averaged 38 in the past five years. Margins for services averaged 61 in the past four years, almost double the product margins of 33. We forecast elevated margins for both services and products for FY21 and FY22 on the back of higher ASPs of new 5G devices and a higher installed base for services boosting operating leverage. Normalisation of freight costs could jack up product margins further."
24,3,"Assets Fixed assets increased modestly by 36 in the past five years to US37bn, roughly in line with revenue growth of 27 between FY16 to FY20. Fixed assets only comprised 8 of total assets as Apple outsources most of its manufacturing needs. Inventory grew 90 in the past five years to US4bn, likely due to Apples wider range of product lineups in recent years."
25,3,Liabilities Net debt averaged US19bn in the past five years. It was pared down to lower levels in FY19 and FY20 as fixed assets were flat in those years.
26,3,"Apple historically generates strong cash flows every year. Cash flow from operations in FY20 jumped 16 YoY to US81bn from a strong iPhone 12 launch. Much of the cash was used for stock repurchases of US72bn in that year. Meanwhile, capex averaged US11bn in the last five years, largely stable."
27,3,Figure 4 Net debt averaged US19bn in the past five years Figure 5 Strong cash flows every year used for stock buybacks
28,3,"Recent product launches iPhone 12 with 5G Apple designs, makes and markets smartphones, personal computers, tablets, wearables and accessories, and sells a variety of related services. Customers are primarily in the consumer, small and midsized business, education, enterprise and government markets. Apple sells its products and resells thirdparty products in most of its markets directly to customers through retail and online stores and a direct sales force. It also distributes indirectly through thirdparty cellular network carriers, wholesalers, retailers and resellers. FY20 net sales through direct and indirect distribution channels accounted for 34 and 66, respectively, of total net sales. No single customer accounted for more than 10 of net sales in 2020, 2019 and 2018. Main markets are the Americas 45 of FY20 sales, Europe 25, Greater China 15, Japan 8, and the rest of Asia Pacific 7."
29,3,"In the service segment, the main revenue contributor is the App Store, which takes in 30 iMac with new M1 chip of revenue from inapp purchases of games, app sales, and app subscriptions. Next is licensing, which includes payments from companies like Google to be featured on Apple products. Other services include AppleCare, which is Apples extended warranty service with a price range that depends on the product. iCloud generates revenue through subscription fees for use of cloud data. Apple Music also generates subscription fees as well as revenue from carrier partnerships. Apple Pay earns a percentage of transaction fees from users and banks. New to services and not yet meaningfully contributing are Apple TV, which earns subscription fees, and Apple Card, where Apple likely takes a cut of the interest charged by its partner bank."
30,3,"The highend smartphone market is predominantly served by Apple and Samsung. Huawei has fallen out of the ranks following U.S. sanctions. Apples share of global smartphone sales averaged 14 in the past three years, hitting a historical high of 21 in 4Q20 on the back of the iPhone 12 launch Figure 8. The International Data Corporation IDC expects the global smartphone market to grow at a 3.6 CAGR over Figure 6. Apples key markets, China 18 of sales and the US 45, are forecast to grow 6.0 and 3.5 respectively."
31,3,"Despite tepid market growth, Apple can rely on its consistently growing ecosystem of installed users to outperform the market. The iPhones installed base breached 1bn in 2020 Figure 9, growing by a stronger 5year CAGR of 7 than the prepandemic smartphone sales CAGR of 2. Most iPhones are sold to upgraders in its installed base Figure 7."
32,3,Figure 6 Modest forecast of 3.6 CAGR for smartphone shipments Figure 7 Over 80 of iPhone sales are made to upgraders
33,3,"Figure 9 iPhones installed base continually grows Figure 8 Apples share of smartphone sales hit a historical high in 4Q20 of 21, thanks to iPhone 12"
34,3,"1. Antitrust laws could affect service revenue. Apple could lower its App Store fees for larger developers as a result of lawsuits. Apple last year lowered its fee to 15 for smaller developers making less than US1mn per year from their apps. But App Store revenue is largely driven by its larger developer base, contributing 30 fees."
35,3,"2. Chinas gaming crackdown could hit App Store spending. Chinas gaming revenue contributed an estimated US2bn or 13 to App Store revenue in FY19. That said, even if Chinas gaming crackdown intensifies, we believe the impact will be minimal as Chinas gaming revenue translated to less than 1 of FY19 revenue."
36,3,3. Chip supply shortage. Apple guided for a US34bn of impact from chip shortages earlier this year. This will affect iPhone and iPad sales in the coming quarter. There is a risk of the impact coming in at the higher end of the range.
37,3,Figure 10 Our DCF value is US187.0
38,3,"We initiate coverage on Apple Inc with a BUY recommendation. We have a DCF valuation of US187.0, based on a WACC of 5.8 and terminal growth rate of 3.0."
39,4,"Merck acquired OncoImmune Private for 425mn this morning, with the focus on latters CD24Fc program biological"
40,4,immunomodulator for the treatment of COVID19. In the context of OncoImmunes toplined phase 3 data reported in
41,4,"September, the notable detail is the price 425mn notable in how quickly implied valuations for COVID19 therapies"
42,4,"have fallen since the spring, when Gileads remdesivir held implied valuations of 15bn at times. At this price and given"
43,4,"increased questions surrounding remdesivirs continued use, we suspect that Merck will ultimately be able to justify the"
44,4,materialize postCOVID19. While full details from the phase 3 have yet to be released and publication is likely in the
45,4,"nearterm, todays announcement likely implies that the topline data accurately characterize the drugs efficacy. Overall,"
46,4,"we dont see this deal meaningfully moving the needle for Merck, but also see minimal downside with potential upside"
47,4,optionality if a broader stockpiling opportunity or applicability to other ID indications materialize. The deal is all cash and
48,4,OncoImmune Deal and CD24Fc. OncoImmune toplined phase 3 data for CD24Fc in severecritical COVID19 patients
49,4,"in September, and, while full details are pending submission to a peerreviewed journal, initial results are encouraging"
50,4,"days vs. 10 days for placebo, and the risk of death or respiratory failure was reduced by more than 50 notable as"
51,4,remdesivir never showed a significant impact on mortality. While the commercial potential for new COVID19
52,4,"therapeutics has been volatile given new questions surrounding remdesivir, albeit against the backdrop of derisking"
53,4,"vaccine data and EUAs issue for the Lilly and Regeneron antibody approaches, we still see a need for effective"
54,4,therapeutics either for a much lower steady rate of COVID19 infections andor stockpiling purposes.
55,4,Merck DealMaking Activity Oncology and COVID19. Merck has executed on 8 transactions over the past 12
56,4,"months, focused exclusively on oncology and COVID19. Merck executed three ID transaction over that period two"
57,4,"acquisitions and one RD collaboration, and while the programs are focused on COVID19, we think the programs could"
58,5,"PepsiCo PEP, Overweight rated is scheduled to report 4Q21 earnings results on Thursday, February 10, before the open. We have adjusted a few of our underlying assumptions to better reflect the likely more challenging operating environment during 4Qi.e., increased pricing actions but more than offset by worsened supply chain pressures as well as updated FX outlook, which results in our totalorganic sales moving to 8.98.4, from 9.28.6 previously. Even after reducing this outlook, we are still ahead of the current Consensus Metrix and implied company guided 4Q organic growth of 7.6 and 7.1, respectively. From a bottomline perspective, our 4Q21 EPS of 1.53 remains unchanged and is ahead of current Bloomberg consensus of 1.52and, for what its worth the implied 4Q company guidance of 1.47 that is likely the bare minimum. We expect that underlying consumer demand remained strong at the end of the year and that the additional pricing actions in the fall began to flow though in the 4Q21 although more so in 1Q22 and help to mitigate some of the inflationary pressures. While some of the operational issues experienced in 3Q should have resolvedlessened e.g., FLNA plant disruption, Gatorade shortage, we would not be surprised to see other pain points in 4Q including potential for employee absenteeism impacting productionsupply and publicized snacks issue in UK relating to SAP upgrade. Netnet, our estimates imply a 6.6 twoyear organic sales CAGR, just in line with 3Q. Looking ahead to 2022, we think PEP got a good amount of credit for providing muchneeded visibility earlier in 3Q21 by committing to its longterm financial algorithm MSD top line and HSD EPS despite the significant inflationary pressures. As such,weare not expecting much of a surprise when the company provides official initial guidance now with 4Q earnings under its belt, although expected dilution from juice brands divestiture announced in August 2021 could lead to core EPS modestly below HSD growth were modeling for 5.2 organic topline and 6.1 EPS growth, or 7.7 predilution. As has been the norm from staples earnings so far, in particular HPC, the operating environment has arguably gotten incrementally challenging from a supply chain perspective near term, which is the main reason we are now more conservative, although we think PEP has enough levers to mitigate e.g., RGM, productivity. Netnet we expect continued solid performance from PEP, and its resilient and defensive business model is clearly in favor as evidenced by its outperformanceof late since 3Q results PEP 16.1 vs. XLP 11.1 and SPX 3.1, and while current valuation is making it tougher to see more meaningful upside in shares near term, we think PEP remains a core staples holding given its resilience of aboveaverage underlying topand bottomline growth and better visibility, which are the primary investment merits that investors look for in staples.."
59,5,"Framing TopLine Expectations for 2022. Following a very strong year from a top line organic growth perspective in 2021 expectation to close the year at approximately 8 on top of 4.3 organic growth in 2020 despite pandemic impact, the company is expecting 2022 to be consistent with its longterm financial algorithm, which calls for MSD 46 organic growth. While the company moved past the worst of the pandemic impacts in 2021, the year was not without challenges, and with still recovering marketsand various supply chain issues through the year, we see continued runway for recovery and underlying growth in 2022 across segments excluding juice divestiture impact in PBNA given pricing actions and volume growth with improving supply conditions, recovering awayfromhome volumes, and resilient athome performance. At a high level, we think the underlying momentum driven by investments in marketing and innovation position the company well to deliver in line with its MSD organic growth targets, particularly given momentum in FLNA and PBNA which we discuss more in the note. All in, we are currently forecasting organic revenue growth of 5.2 volumesup 1.6 and pricemix up 3.6, which is very slightly ahead of Consensus Metrix consensus of 5.1."
60,5,"What Will Margins Look Like in 2022? PEPs ability to potentially drive margin expansion in 2022 despite the significant inflationary pressures being seen throughout the industry should set it apart from the majority of CPG peers and highlight the resilience and attractiveness of its business model, which calls for core operating margin expansion of 2030 bps per annum. PEP has solid visibility into expected cost pressures and has taken multiple rounds to price through higher inflation, including some over the summer and much more in the fall, with the full impact being seen in 1Q22. The company should also continue to execute against 1 billion annual productivity initiatives, which is mostly reliant on leveraging automation and digitization and should be particularly helpful in an environment with higher labor inflation. The divestiture of lowermargin juice business we estimate the business generated HSD EBIT margins will be a benefit to margins, which we estimate could be worth about 2030 bps to gross and EBIT margins. While the input cost environment continues to evolve, given the pricing and productivity efforts across the business, we think PEP can deliver about 20 bps gross margins expansion in 2022 roughly flat predivestiture and operating margin expansion of 65bps33 bps pre divestiture."
61,5,"Updated FX Outlook. With its 3Q21 earnings release, PEP reiterated its outlook for FX to be a 1 translational tailwind to both revenue and EPS, and since the day prior to that release October 4, 2021 FX has turned less favorable by about 60 bps for 4Q according to our currency model, and looking ahead to 2022, the impact of currency has gotten incrementally unfavorable by about 50 bps. Netnet for 2022, we would expect currency to be a headwind of about 1. For 4Q21 and 2022 we are now forecasting FX to be a 30 bps benefit and 100 bps headwind, respectively, vs.60 bps benefit and flat previously."
62,5,"4Q21 Expectations. Our 4Q21 EPS of1.53is unchanged vs. Bloomberg consensus of 1.52 and companyguided implied 4Q EPS of at least 1.47 even as we tweak a number of our underlying assumptions to better reflect our view of the operating environment in 4Q and the scanner data, as well as updated FX outlook. As such, our 4Q organic growth estimate moves to 8.4 from 8.6 previously, but is still ahead of current Consensus Metrix of 7.6 and companyguided implies 4Qorganic growth of 7.1. We are expecting an acceleration of pricemix in the quarter as additional pricing actions begin to flow through our 5.3 pricemix is ahead of consensus"
63,5,"5.0 and implies a modest sequential acceleration in the twoyear CAGR while our 3.0 volume growth is 20 bps ahead of consensus and implies roughly flat sequential twoyear CAGR. From a margin perspective, we expect gross margin compression of 75 bps to 52.7 vs. consensus 52.5 and 5 bps of leverage on SGA to 40.7 vs. consensus 40.6 as incremental pricing actions and productivity partially offset inflationary and supply chain pressures while increased AM is offset by reduced COVID19 costs. Additional detailsinside."
