,ID,paragraphs
64,6,"While we thought nancial and operational Q4 results for T were largely in line with our Eric Luebchow, CFA expectations, the controversy around the spin vs. split debate continues to weigh T management seemed to be more open to a spino vs. a split on the call, on shares. Caleb Stein which would be a simpler transaction but wouldnt give T the ability to immediately retire its shares. But even in a spin scenario, Ts RemainCo trades at 6.7x our 2022E RemainCo EBITDA and 6.2x EPS, with a 6.4 dividend yield. More encouragingly, we now have greater clarity on Ts path to 20B of FCF in 2023 based on the outlook. While the stock may remain volatile in the near term as investors digest the potential puts and takes of the WM structure, we think the current valuation limits downside risk, even if T elects to pursue a spin vs. split. We are lowering our PT to 26 from 27 to reect the lower implied value of WM of 6share vs. 7share previously."
65,6,"Heading into earnings, T investors were Spin vs. Split Debate Weighs Over Earnings. favoring a split vs. a spino, or an exchange of T stock for DISCA where investors have the option to swap T for New DISCA stock. Its clearly a more complicated transaction in which T would likely have to oer a kicker for investors to exchange shares, but eectively would enable them to retire 1.7B total shares akin to a share buyback. Management on the call seemed to be leaning slightly more toward a spino, which is a cleaner, simpler transaction particularly for Ts retail base for a split of this size. Either way, it doesnt materially change the outlook for RemainCo, which in a spinscenario is currently trading at 6.7x our 2022E RemainCo EBITDA, 6.2x Diluted EPS and with a 6 dividend yield."
66,6,"While we were initially Details Around Path to 20B of 2023 FCF Begin to Emerge quite skeptical about Ts ability to hit 20B of RemainCo FCF in 2023, the guide for 2022 provides a reasonable pathway, in our view. For instance, T is guiding to 23B of combined FCF for FY2022, or 20B if you strip out a 3B contribution from WarnerMedia. Looking into 2023, cash capex will likely be 4B higher as they accelerate wireless and ber spending, but interest expense should be 1.6B lower and organic EBITDA, by our estimates, should grow 23B. While some of the moving pieces in other free cash ow items remain uncertain cash taxes, working capital, etc, the 20B outlook for next year seems like an achievable goal."
67,6,". T provided Plans to Reach 200MM POPs on 80MHz of MidBand Spectrum by YE2023 clarity that it plans to reach 200MM POPs with 80MHz of midband spectrum 40MHz C Band 40MHz 3.453.55MHz won in Auction 110 by YE2023. The build will commence more materially in mid2022 once the spectrum is made available in latespring early summer. T plans to deploy both spectrum bands eciently with one tower climb, and highlighted 8B in 3year investment to achieve this spectrum deployment. This build will still put T in 3rd place to its peers TMUS and VZ in terms of midband 5G coverage, but does at least help close the gap."
68,6,"Our estimates for RemainCo have largely Remain at Equal Weight Price Target to 26 remained in line, as we expect moderating phone sub growth 2.3MM in 2022, although our 2022 Mobility EBITDA has been reset marginally lower to account for 350MM of higher costs due to 3G network shutdown, FirstNet and support funding for CAF2 in Q1. Our new price target of 26 implies 20share value for Ts RemainCo and 6share"
69,6,"for its stake in WarnerMedia. Our new FY22 EPS are 3.13 vs. 3.23 prior and our FY23 are 3.34 vs. 3.40 prior, although these ests include WarnerMedia."
70,6,"T reported Q4 total revenue, Adjusted EBITDA, and Adjusted EPS of Q4 2021 Results Summary 41.0B, 11.3B and 0.78 vs. our estimates of 41.1B, 12.7B and 0.77 Street consensus 40.3B, 12.6B and 0.76, respectively. Q4 capex was 3.8B and FCF was 8.7B, resulting in a dividend payout ratio of 51 vs. our estimates of 4.7B, 8.9B, and 42, respectively."
71,6,". T prereleased Subscriber Growth Impressed Across Mobility, Broadband, and Media Segments select subscriber metrics when it presented at an investor conference on 15. While known, the results were impressive, particularly on the mobility side, which added more subscribers in FY2021 3.2MM than in the prior 10 years combined. T reported 1.3MM postpaid net adds in Q4, with 880K postpaid phones, and 29K prepaid phones."
72,6,"Expect Fiber Broadband Net Adds to Accelerate as Scaled Build Improves Penetration and Cycle . Current ber cycle times are 12 months from the time the engineering begins Times Reduce until the sites are turned on and actively marketed. That cycle time is expected to contract to 9 months now that T has worked through supply chain constraints it experienced. The shorter cycle time, when coupled with the greater number of passings and improving penetration rates, should result in an accelerated number of ber broadband net adds. We expect the natural operating leverage generated by the ber build, plus the benet from cost transformation initiatives, to result in EBITDA improvement in 2022."
73,6,"Our 26 price target is based on a combination of our sum of the parts and DCF valuations, and implies 7.0x 2022E EVEBITDA for Ts RemainCo and 6share for its stake in WarnerMedia."
74,6,Upside risks include FCF and dividend coverage improving faster than expected ATT taking more share in the competitive wireless market and possible share repurchases as deleveraging continues. Downside risks include compressing margins as it competes for share in wireless market share losses as it trails its peers on midband 5G coverage and share price volatility once it cuts its dividend by 40.
75,6,"T We have an Equal Weight rating on Ts stock, as we believe strength and execution in its core wireless business will oset some secular challenges in other business segments i.e. legacy wireline. With the WarnerMedia spinsplit looming, proforma T should be a healthier company with the opportunity to organically grow at a low to midsingledigit rate."
76,7,"Summary V reported FYQ4 adj EPS of 1.12, 5c above our estimate and 3c ahead of consensus. The beat vs our model was driven by lower incentives and slightly better cross border revs on fx volatility. Net revs were 5.1B, down 17 yy or 11 adjusting for the service rev lag. Net revs were slightly above our 4.97B est and consensus at 5.0B. Opex was 1.94B, a tad above our 1.92B est. Payment volumes were 4 yy vs down 10 yy last qtr. They repurchased 1.6B of stock during the qtr. Quarterly dividend increased to 0.32c."
77,7,"October Spend Volumes Steady Cross border volumes ex intraEurope stayed range bound and late October was down 37 yy, the same as early Septembers temporary pick up. US volumes showed modest improvement in October but that likely benefited from the Amazon Prime Day, so well view it as unchanged."
78,7,"2021 Guidance Mgt expects negative revenue growth in H121, then rebounding significantly in H221. Client incentives 25.526.5 though lower in Q1. This is an unusually high level of incentives for V and is a function of volume recovery price point. If processed trans and CB volume growth remains at October levels, theyd expect net revs to be down in the high single to low double digit range for FYQ1. Valueadded services up midteens in 21. Opex H121 down 5 or roughly equal to H220 level. Then midsingle digit growth in Q2 and double digit growth in H221 partly on Olympics."
79,7,"The Stock Solid qtr for V given the environment, but the results were a reminder that networks face earnings risk as cross border travel is still down hard. V noted that of 217 countries around the world, 74 still had complete or partial border closings, with most of the remainder requiring quarantine and COVID tests. This is at least some improvement from 87 last qtr. We expect some volatility as COVID levels increase, but we believe the longterm story remains intact and we are buyers through the weakness."
80,7,"Estimate Revisions We are lowering our 2021 EPS estimate to 5.35 from 5.90, reflecting a longer time frame for the cross border volume recovery. This is partially offset by lower operating expenses. Target down to 210 31x CY22 EPS est."
81,7,"Price Target 210 from 230 We rate Visa shares Overweight with a price target of 210. Our target is based on just over 36x our CY21 estimate of 5.72 and implies a 31x PE on our 2022 CY EPS estimate. The primary risks to our price target include heightened regulatory scrutiny, litigation, disintermediation from banks and emerging payment types, and adverse currency movements."
82,7,"We remain constructive on V and believe they are well positioned to rebound solidly once we get through the challenging global environment due to the virus. Quarterly spend trends improved through the quarter, and crossborder is showing signs of life. The pandemic pulled forward secular trends, such as online and digital, where V has greater market share."
83,7,"Visa is a global payments technology company that connects customers, merchants, banks, businesses, and governments in more than 200 countries and territories, and enables fast, secure, and reliable payments. Visa is a large global payment network that facilitates the authorization, clearing, and settlement of payment transactions globally. Visa recently closed the acquisition of Visa Europe. Visa became a public company in 2006 and is based in the San Francisco Bay Area."
84,8,APPLE EARNINGS PREVIEW DOWNGRADE TO HOLD AS SHARES HIT PRICE TARGET.
85,8,"PRICE PERFORMANCE CHART The risks seem balanced, to the upside and downside, with good news priced in."
86,8,"Shares of Apple have produced a total return dividends reinvested of 42.5 since our upgrade on April 22, 2013 compared to a total return of the SP500 index of 16.4 dividends reinvested. We are reducing our rating to HOLD from BUY as the stock has reached our 550 price target and we expect the performance of the stock to track more in line with the broader market index."
87,8,"We expect Apple to post an astounding quarter with over 80 million iOS units sold, powered by the view that the company makes the best products in the space. That said, we see that the market has already broadly anticipated a record quarter, and the upside risks seem balanced with downside risks in our view. Yes, we could be giving away some upside on the reaction to the December quarter print, particularly if the company can ship 5760 million iPhones or produce results with revenue and EPS around 60 billion and 15. That said, we see that expectations are again possibly overheating, particularly with regard to the opportunity with China Mobile. Additionally the market dynamic where the functionality gap between products is closing, while the price gap is widening remains an issue for Apple. Broadly speaking, the next 1 billion people purchasing smartphones are going to be from demographics less wealthy than the first billion, and the skew towards lower priced hardware is likely to continue. We do not suggest that Apple, as a highend brand, needs to chase after the lowend market, but we do suggest that the company introduce new products to its customer base."
88,8,"We remain positive on Apples ability to introduce wearable products that target the quantified self, a market we see as a natural fit to the Apple customer base. We are also positive on the potential for beacons and payments. We appreciate the concept of ultrahigh definition TVs, and the streaming potential for associated content from iTunes, but caution this type of product may capture less than the 10 market share suggested by certain investors in a recent SEC filing."
89,8,"It is also worth mentioning that one can argue that Apple is lagging in critical areas, with high profile wearable products from competitors already on the market such as Glass, inexpensive products such as Chromecast linking tabletsphonesPCs to TVs, and Apples approximately 575 million credit cards associated with iTunes an underutilized asset as it is not being broadly used for other payments."
90,8,"Valuation. While we appreciate that Apples shares may look appealing from a ratio perspective, trading at 12.3x our FY2014 earnings estimate, we mention again that Company Data earnings of companies in a fast moving technology landscape can change quickly. Apple remains that largest capitalized company on a U.S. listed exchange with its 493B valuation and as such we see the company as also being subject to selling for reasons outside of its fundamentals such as cash liquidation needs."
91,8,"Company guidance for the December quarter is 5558B in revenue, gross margin of 36.537.5, tax rate to be 26.25, other incomeexpense of 200M and operating expense of 4.44.5B."
92,8,"Balance Sheet AAPL has 146.7B in cash 161.40 share and 17B longterm debt as of September 30, 2013."
93,8,Revenue Reported EPS Reported M Q1 Dec Q1 Dec Q2 Mar Q2 Mar Q3 Jun Q3 Jun Q4 Sep Q4 Sep FY Fiscal Sep FY Fiscal Sep Bloomberg Bloomberg EPS FY Revenue FY
94,8,Source IDC Worldwide Quarterly PC Tracker. Quarterly data shown is tied to Microsofts Fiscal June year.
95,8,Source Company Documents and BGC Financial. Data is based on fiscal year ending September.
96,8,Source Company Documents and BGC Financial. Data is based on fiscal year ending September.
97,8,Source Company Documents and BGC Financial. Data is based on fiscal year ending September.
98,8,Source Company Documents and BGC Financial. Data is based on fiscal year ending September.
99,8,Source Company Documents and BGC Financial. Data is based on fiscal year ending September.
100,9,"INVESTMENT HIGHLIGHTS NA We make no changes to our 2Q14 estimate for revenue of 6.846B down 8 yy, Adjusted Operating Income of 1.47B down 3 yy, and EPS from Operations of 0.84 up 3 yy. We are adjusting the profit mix by segment a little Entertainment Internet bit. On TWXs Aug 6 conference call, we are most interested in learning about TWXs plan to create more value over the next 18 months than shareholders could receive from 2Q14. selling their shares to another owner. Key points regarding 2Q14 include"
101,9,"TWX will release 2Q14 earnings on Wednesday, August 6, 2014 before the market opens and will host a management conference call at 1030amET to discuss results. The call in number is 800 4462782, Passcode ."
102,9,"We make no changes to our 2Q14 estimates and estimate revenue of 6.846B down 8 yy, Adjusted Operating Income of 1.47B down 3 yy, and EPS from Operations of 0.84 up 3 yy. We adjust our profitability mix for Home Box Office and Warner Brothers to reflect i higher than previously estimated The Hobbit programming expenses at HBO resulting in lower profitability and, ii better than Lego expected profitability at Warner Brothers due to the DVD success of and the movies."
103,9,"Nielsen data for 2Q14 indicates that TWXs combined US ratings fell 11 yy in 2Q14, its weakest performance of the past 6 quarters. In the past, TWXs US ad revenue is typically 914 above its US ratings. Therefore, we estimate that TWX will FY14. report US TV ad revenue up 1, in line with guidance of low single digits."
104,9,"We maintain our estimates for FY14 and expect Revenue of 28.9B up 9 yy, Rating. and we expect EPS from Operations of 4.00 up 5 yy."
105,9,"The bulk of TWXs profits come from two of the fastest growing silos with the most pricing power in the media landscape film and cable networks. TWX owns one of the preeminent cable network groups in the US, with fullydistributed, missioncritical to MSOs, telcos, satellite companies cable channels including, among others, TBS, TNT, Cartoon Network, Boomerang, truTV, TCM Turner Classic Movies, CNN, and Headline News HLN. Warner Bros. film studio is the preeminent film studio in the US, with one of the finest content libraries on the planet. Risks to Target"
106,9,"Risks to TWX include a weakening economy, a declining advertising market, declining ratings of its produced shows, and rising costs of production as well as sports rights fees, resulting in margin shrinkage."
107,11,"Verizon was the fourth straight carrier to beat wireless subscriber expectations. Sub trends, which accelerated yy on a"
108,11,"tough comp, were expected to be robust after the company launched its muchanticipated Disney promo in December."
109,11,"However, cost growth once again came in above expectations which led to a miss on wireless EBITDA margin. While VZ"
110,11,"has suffered from this more than other carriers throughout the year, and part of this is due to accounting, this theme has"
111,11,appeared to have picked up this quarter industrywide. The company also missed its service revenue growth guidance.
112,11,"Going into 2020, VZ will no longer report Wireless segment results separately, which will make it difficult to benchmark"
113,11,organic margin trendlines. This could make for a tricky dynamic given that margin expansion expectations continue to
114,11,fall but visibility will be limited beginning next quarter.
115,11,Sub beat potentially driven by promos VZ postpaid phone net adds of 790k beat our already optimistic
116,11,expectations of 747k consensus 652k with the second derivative accelerating yy. Much of this strength appears to
117,11,aggressive in the handset promotion market as well as on Black Friday. While perhaps some had expected stronger
118,11,"performance on the Disney front considering headlines around Disney initial sub ramp, we do acknowledge that"
119,11,"Disney likely had much more significant uptake on the existing phone base rather than driving gross adds. In addition,"
120,11,"last years Q4 benefited heavily from the successful iPhone launch, which we estimate could have created a comp"
121,11,headwind by as much as 100200k subs. If we assume this impact from last years iPhone on top of organic growth say
122,11,"50k, this implies that Disney itself could have added 200250k subs in the quarter. While this is optically rather"
123,11,"small relative to the 20mm Disney sub number, we do acknowledge that the sub tailwind was over only one month and"
124,11,it appears that the bundle has had a larger impact on existing account churn. While postpaid phone churn rose
125,11,"seasonally as per usual 4bps qq, the magnitude was much lower than T, TMUS 12bps each and S 13bps. This"
126,11,would imply that the tailwind to Disney from Verizon came from existing VZ subs which could have contributed 34mm
127,11,"to Disney subs in the quarter overall. If this estimate is borne out, then Verizons contribution to growth for Disney"
128,11,next quarter will need to be more gross add heavy given the already high penetration of existing base that is eligible.
129,11,"However, Q1 tends to be a seasonally weak quarter for phone net additions which makes this tougher."
130,11,Revenue guidance misses The company surprisingly missed wireless service revenue guidance 2.7 vs. guidance
131,11,of 33.5 despite ARPA coming inline. Part of this could be due to account penetration growing faster than expected
132,11,3.27 vs. 3.25 linesaccount est. as a result of Disney and other promotions which dragged on ARPU despite ARPA
133,11,coming in better. Another explanation could potentially be wholesale revenue growth slowing on a yy basis. The dynamic
134,11,which is likely to get tougher is the tailwind from cable MVNO revenue growth which should slow because of lapping the
135,11,Charter launch. The competitive environment for retail also looks set to be tougher in 2020 given ATT comments and
136,11,"launch of HBO Max. The course of the STMUS deal could add further to competitive headwinds. Consequently, 2020"
137,11,single digits may need to lean a lot more on equipment revenues. The ending of Disney promotions second half of next
138,11,year should also help ARPA and therefore service revenue growth but this is simply due to accounting treatment and
139,11,doesnt really help margins as it is a passthrough please see How does accounting impact telecom industry
140,11,"Margin trends again disappoint On a reported basis, wireless EBITDA service margin was 180bps lower yy due to"
141,11,"was due to accounting, even excluding this, wireless service margin was nonetheless slightly down for the quarter and"
142,11,"was likely flat for the year. This marks the first year wireless margin has not expanded yy since 2014, the year when"
143,11,"TMUS began aggressively retaking share and when handset upgrade rates were at their last peak. The difference,"
144,11,"however, in industry fundamentals between then and today is quite large in that VZ margin remained flat in 2019 during"
145,11,a relatively benign competitive environment with upgrade rates at an alltime low. This has negative readthroughs
146,11,heading into the next two years where competition is beginning to heat up and VZ will have difficult cost of service
147,11,"comps in the first half due to Disney. Execution and visibility, the fountainheads of VZ equity performance, are also"
148,11,likely to be bigger issues given that the company will no longer report wireless segment margin separately.
149,11,"Wireline deteriorating faster For several quarters now, wireline EBITDA has disappointed to the downside and this"
150,11,trend appears to have no signs of abating anytime soon. The magnitude of the miss this quarter was quite material with
151,11,wireline EBITDA coming in 30 lower than ours and consensus estimates. This appears to be on the back of robust
152,11,SGA growth exaccounting impact which is quite counterintuitive for a business that is secularly declining in the mid
153,11,"single digit range. Heading into next quarters resegmentation, this has negative implications with wireless segment"
154,11,"results potentially obscured by deteriorating wireline trends on the Consumer and Business segments. Laterally, Verizon"
155,11,continues the trend of acceleration in video declines which adds to the drumbeat from other MVPDs during the quarter.
156,11,The companys recent change in pricing plan for Fios could also incentivize more cord cutting which is likely to result in
157,12,"NEUTRAL Industry View The strength in WMTs core business continues. Core U.S. EBIT growth of 6.1 was Unchanged the 4th consecutive quarter of 4 growth. U.S. comps of 3.2 ex gas were slightly USD 135.00 Price Target above expectations despite softer apparel sales unseasonably warm September, and raised 8 from USD 125.00 U.S. GM was down only 4 bps while opex leveraged by 21 bps. Weaker Sams results driven by techwageprice investments and International FXmacro weakness Price 13Nov2019 USD 120.98 offset much of the core, but the focus continues to be largely on the U.S. Going Potential UpsideDownside 11.6 forward, we caution U.S. gross margin are unlikely to exhibit such strength, but we do Tickers WMT believe the U.S. business can continue to consistently grow EBIT at a MSD pace. Market Cap USD mn 344101 WMTs performance supports a new narrative reflecting 1 sustainable MSD U.S. EBIT Shares Outstanding mn 2844.28 growth driven by a improving ecomm rate profitability and strong revenue growth Free Float 49.20 price investments, continued pickupdelivery rollout, general merchandise SKU 52 Wk Avg Daily Volume mn 6.6 additions to grocery app, nextday shipping rollout, and continued addition of brands, Dividend Yield 1.8 Return on Equity TTM 18.16 b mix benefits from general merchandise, private label, and ecomm marketplace Current BVPS USD 24.70 growth, and c accelerating share gains in food as a result of price investments and 2 accelerating EPS growth as Flipkart dilution is lapped . As such, we believe WMT is"
158,12,"now entering more of harvest mode as it reaps the benefits of its multiyear Price Performance ExchangeNYSE investment cycle. As such, while skeptics may question WMTs multiple vs. historical 52 Week range USD 121.3685.78 norms, the real debate should be centered on the E as FY21 Street expectations could"
159,12,"be conservative. We are raising our EPSEBITDA estimates as we now incorporate 5 core U.S. EBIT growth in FY21. We are increasing our PT to 135, reflecting 12.3x FY21 EVEBITDA up from 11.5x. We also present our SOTP valuation framework Figure 1"
160,12,"as food for thought, although we continue to prefer a more holistic valuation approach."
161,12,Details on 3Q results EPS of 1.16 beat consensusBarclays of 1.091.08. 1 U.S. ecommerce grew 41 2yr acceleration 2 U.S. stacked comps of 6.6 decelerated 70bps sequentially but remain above FY19s 5.7 average 3 there was slight food
162,12,"deflation consumables inflation 4 FY20 adj. EPS is now guided to increase slightly YY while the effective tax rate was revised down to 25.025.5 2627 previously. North America Food Staples Retailing Karen Short WMT Quarterly and Annual EPS USD 1 2021 Change yy BCI, US FY Jan Actual Old New Cons Old New Cons Renato Basanta Q1 1.14A 1.13A 1.13A 1.13A NA NA 1.14E 0.88 NA 1 Q2 1.29A 1.27A 1.27A 1.27A NA NA 1.31E 2 NA Q3 1.08A 1.08E 1.16A 1.09E NA NA 1.14E 7 NA BCI, US Q4 1.41A 1.45E 1.45E 1.45E NA NA 1.53E 3 NA Robert Amparo Year 4.91A 4.93E 5.01E 4.94E 5.19E 5.30E 5.15E 2 6 1 PE 24.6 24.1 22.8 BCI, US"
163,12,"Caitlin Howard 1 Barclays Capital Inc. andor one of its affiliates does and seeks to do business with companies covered in its research reports. As a result, investors should be aware that the BCI, US firm may have a conflict of interest that could affect the objectivity of this report. Investors should consider this report as only a single factor in making their investment decision."
164,12,PLEASE SEE ANALYST CERTIFICATIONS AND IMPORTANT DISCLOSURES BEGINNING ON PAGE 7.
165,12,North America Food Staples Retailing Industry View NEUTRAL
