,Text ID,Sentence ID,Sentence,Provided Arguments
0,1,1,"Q1 Results: Jazz Pharmaceuticals reported strong Q1 results Thursday, revenue $247 million vs. $196 million Q1 FY 13, representing 26% YoY growth.","{""Revenue Growth"": ""positive"", ""Financial Performance"": ""positive""}"
1,1,2,"The GAAP Net Loss $93 million vs. GAAP Net Income $43 million Q1 FY 13, $127 million due upfront license fee milestone payment JZP-110.","{""Financial Performance"": ""negative"", ""License Fees"": ""negative""}"
2,1,3,Adjusted Net Income $101 million vs. $84 million Q1 FY 13.,"{""Financial Performance"": ""positive""}"
3,1,4,These figures slightly ahead Goldman Stanley estimates $240 million revenue $95 million Adjusted Net Income.,"{""Revenue"": ""positive"", ""Financial Performance"": ""positive""}"
4,1,5,"■ FY 14 Guidance: The Company reaffirmed FY 14 guidance across board, revenue $1.10 billion – $1.16 billion, Xyrem sales $755 – $755 million, Erwinaze $185 – $200 million, Defitelio $42 – $52 million, Adjusted Net Income $496 – $520 million.","{""Revenue Guidance"": ""neutral"", ""Sales Performance"": ""neutral"", ""Financial Performance"": ""neutral""}"
5,1,6,"While believe market already priced expectations, continue see Jazz undervalued, high-growth story going forward, believe longer-term revenue, EPS, EBITDA likely exceed consensus estimates FY 15, FY 16, beyond.","{""Growth Expectations"": ""positive"", ""Revenue Outlook"": ""positive"", ""Valuation"": ""positive""}"
6,1,7,"■ Catalysts: 1) Possible price increases Xyrem – Given historical price increases price ranges comparable orphan drugs, believe company likely announce another round price increases end FY 14 early FY 15, significant room grow pricing beyond current levels.","{""Pricing Power"": ""positive"", ""Growth Potential"": ""positive""}"
7,1,8,"2) Launch new marketing campaigns Xyrem – Jazz management process launching awareness campaigns narcolepsy patients key geographies, already reported 11,400 Xyrem patients Q1, FY 14 estimate ~11,300.","{""Marketing Efforts"": ""positive"", ""Patient Growth"": ""positive"", ""Business Operations"": ""neutral""}"
8,1,9,"3) Settlement Roxane lawsuit – We believe decided Jazz’s favor, resulting delayed entrance Xyrem generics.","{""Litigation"": ""positive"", ""Product Launch"": ""neutral""}"
9,1,10,"Current market expectations point generics FY 19 FY 20, believe FY 21 likely (with peak sales ~$3.0 billion FY 20).","{""Market Expectations"": ""neutral"", ""Sales Growth"": ""positive""}"
10,1,11,"■ Our $170.00 target price based FY 14 EV / EBITDA multiple 20.7x FY 15 EV / EBITDA multiple 15.3x, vs. median peer company multiples 21.8x 15.3x, respectively.","{""Valuation"": ""neutral""}"
11,1,12,"Given Jazz’s higher revenue growth, margins, EBITDA growth, believe still quite conservative.","{""Revenue Growth"": ""positive"", ""Margins"": ""positive"", ""EBITDA Growth"": ""positive""}"
12,1,13,"A DCF analysis long-term FCF projections, discount rate 8.07%, Terminal FCF growth rate 0.3% also produces implied share price $168.71.","{""Discount Rate"": ""neutral"", ""FCF Projections"": ""neutral"", ""Terminal Growth Rate"": ""neutral"", ""Share Price"": ""neutral""}"
13,2,1,Apple expects revenue next quarter ending December 2024 increase low- mid-single digits year year.,"{""Revenue Growth"": ""positive""}"
14,2,2,The company looks services revenue grow similar rate nearly 13% growth fiscal year 2024.,"{""Revenue Growth"": ""positive""}"
15,2,3,Chief financial officer Luca Maestri asked analysts couple times fourth-quarterearnings callabout iPhone sales December quarter.,"{""Sales"": ""neutral"", ""Earnings"": ""neutral""}"
16,2,4,He refused answer.,"{""None"": ""neutral""}"
17,2,5,Cook asked demand new iPhones coming quarters.,"{""Demand"": ""positive""}"
18,2,6,"He responded: ""We're projecting beyond current quarter obviously.","{""Guidance"": ""neutral""}"
19,2,7,"We don't that.""",{}
20,2,8,"He would go far say company believes Apple Intelligence ""a compelling upgrade reason.""","{""Upgrade Reason"": ""positive""}"
21,2,9,He also said adoption rate iOS 18.1 twice much iOS 17.1 first three days launch.,"{""Adoption Rate"": ""positive""}"
22,2,10,"Cook added, ""So, clearly shows level interest there.""","{""Market Interest"": ""neutral""}"
